<?xml version='1.0' encoding='UTF-8'?>
<ROWSET xmlns="http://service.henkilo.sade.vm.fi/types/perusopetus/henkilotiedot"
     xmlns:xsi="http://www.w3.org/2001/XMLSchema-instance"
     xsi:schemaLocation="http://service.henkilo.sade.vm.fi/types/perusopetus/henkilotiedot perusopetusHenkiloTiedot.xsd">
    <ROW>
        <VUOSI>2013</VUOSI>
        <KAUSI>S</KAUSI>
        <LAHTOKOULU>05536</LAHTOKOULU>
        <POHJAKOULUTUS>1</POHJAKOULUTUS>
        <OPETUSKIELI>FI</OPETUSKIELI>
        <LUOKKA>9A</LUOKKA>
        <LUOKKATASO>10</LUOKKATASO>
        <HETU>111193-111V</HETU>
        <SUKUPUOLI>1</SUKUPUOLI>
        <SUKUNIMI>Virtanen</SUKUNIMI>
        <ETUNIMET>Ville Valtteri</ETUNIMET>
        <KUTSUMANIMI>Valtteri</KUTSUMANIMI>
        <KOTIKUNTA>240</KOTIKUNTA>
        <AIDINKIELI>FI</AIDINKIELI>
        <KANSALAISUUS>246</KANSALAISUUS>
        <LAHIOSOITE>Kaduntie 156</LAHIOSOITE>
        <POSTINUMERO>20520</POSTINUMERO>
        <MAA>246</MAA>
        <MATKAPUHELIN>040 1234567</MATKAPUHELIN>
        <MUUPUHELIN>5278091</MUUPUHELIN>
        <ERA>PKERA1_2013S_05536</ERA>
    </ROW>
</ROWSET>
